{
  "$schema": "https://json-schema.org/draft/2020-12/schema",
  "$id": "ecosystem/contracts/handoff/1",
  "title": "Handoff de agente — schemaVersion 1",
  "description": "Autoridade canônica do formato de handoff (MANIFEST §23.1, NN-008). Um arquivo por mensagem em docs/governance/handoffs/<message_id>.json.",
  "type": "object",
  "additionalProperties": false,
  "required": [
    "schemaVersion",
    "message_id",
    "category",
    "timestamp",
    "agent",
    "task_id",
    "component",
    "state",
    "branch",
    "commit",
    "pr",
    "files_changed",
    "work_completed",
    "verification",
    "known_issues",
    "blockers",
    "next_actions",
    "decisions_required",
    "normative_sources",
    "invariants"
  ],
  "properties": {
    "$schema": {
      "type": "string"
    },
    "schemaVersion": {
      "const": 1
    },
    "message_id": {
      "type": "string",
      "pattern": "^HO-[0-9]{8}-[a-z0-9]+(-[a-z0-9]+)*$"
    },
    "category": {
      "enum": [
        "HANDOFF",
        "RESULT",
        "BLOCKER",
        "INCIDENT"
      ]
    },
    "timestamp": {
      "description": "Hora real (de preferência UTC) em que o handoff foi escrito ou atualizado. Ordena os handoffs de uma mesma tarefa; nunca no futuro (CHK-HANDOFFS).",
      "type": "string",
      "pattern": "^[0-9]{4}-[0-9]{2}-[0-9]{2}T[0-9]{2}:[0-9]{2}(:[0-9]{2})?(\\.[0-9]+)?(Z|[+-][0-9]{2}:[0-9]{2})$"
    },
    "agent": {
      "type": "object",
      "additionalProperties": false,
      "required": [
        "id",
        "kind"
      ],
      "properties": {
        "id": {
          "type": "string",
          "minLength": 1
        },
        "kind": {
          "enum": [
            "ai-agent",
            "human"
          ]
        },
        "session": {
          "type": "string"
        }
      }
    },
    "task_id": {
      "type": "string",
      "pattern": "^[A-Z][A-Z0-9]*-[0-9]+(\\.[0-9]+)*$"
    },
    "component": {
      "type": "string",
      "pattern": "^[a-z][a-z0-9]*(-[a-z0-9]+)*$"
    },
    "state": {
      "enum": [
        "planned",
        "claimed",
        "working",
        "waiting",
        "blocked",
        "verifying",
        "review",
        "done",
        "failed",
        "cancelled"
      ]
    },
    "branch": {
      "type": "string",
      "minLength": 1
    },
    "commit": {
      "description": "WORK RESULT (ADR-0014): SHA do commit que contém o resultado do agente, quando já é conhecido ao gravar o handoff (ex.: atualização posterior). null = derivado: o resultado é o commit que introduz/atualiza este handoff na `branch` (o arquivo não pode conhecer o próprio hash). NUNCA o commit de partida (isso é `base_commit`). A INTEGRAÇÃO é o merge do `pr` na main (derivado do PR, não gravado aqui).",
      "type": [
        "string",
        "null"
      ],
      "pattern": "^[0-9a-f]{7,40}$"
    },
    "pr": {
      "description": "URL do PR que integra o trabalho (ponto de integração, ADR-0014), ou null quando ainda não aberto ou quando o trabalho foi integrado sem PR (histórico anterior ao ADR-0014).",
      "type": [
        "string",
        "null"
      ]
    },
    "files_changed": {
      "type": "array",
      "items": {
        "type": "string",
        "minLength": 1
      }
    },
    "work_completed": {
      "type": "array",
      "items": {
        "type": "string",
        "minLength": 1
      }
    },
    "verification": {
      "type": "array",
      "items": {
        "type": "object",
        "additionalProperties": false,
        "required": [
          "check",
          "kind",
          "result"
        ],
        "properties": {
          "check": {
            "type": "string",
            "minLength": 1
          },
          "kind": {
            "enum": [
              "automated",
              "human"
            ]
          },
          "result": {
            "enum": [
              "passed",
              "failed",
              "pending",
              "not-applicable"
            ]
          },
          "evidence": {
            "type": "string"
          },
          "object": {
            "description": "O que deve ser validado/decidido: caminho no repositório ou URL do artefato/página. Obrigatório (verificado por CHK-HANDOFFS) quando kind = human e result = pending, para que o portal apresente o objeto (DEC-0007).",
            "type": "string",
            "minLength": 1
          },
          "critical": {
            "description": "Validação humana crítica (ADD-0012; communication.md §9): gate de fase, instalação/atualização de build distribuído, dados do usuário, segurança ou release. Crítica aparece em 'Precisa de você' no portal; não crítica continua pendente e visível (NN-017), sem interromper o proprietário. Obrigatório (CHK-HANDOFFS) quando kind = human e result = pending, para handoffs a partir de 2026-10-02.",
            "type": "boolean"
          },
          "tested_commit": {
            "description": "VALIDATION (ADR-0014): SHA do estado efetivamente testado por esta verificação (pode diferir do resultado, ex.: estado combinado após reconciliação com a main).",
            "type": "string",
            "pattern": "^[0-9a-f]{7,40}$"
          }
        }
      }
    },
    "known_issues": {
      "type": "array",
      "items": {
        "type": "string",
        "minLength": 1
      }
    },
    "blockers": {
      "type": "array",
      "items": {
        "type": "string",
        "minLength": 1
      }
    },
    "next_actions": {
      "type": "array",
      "items": {
        "type": "string",
        "minLength": 1
      }
    },
    "decisions_required": {
      "description": "IDs de decisões pendentes em docs/governance/decisions.json.",
      "type": "array",
      "items": {
        "type": "string",
        "pattern": "^DEC-[0-9]{4}$"
      }
    },
    "normative_sources": {
      "description": "Documentos normativos consultados diretamente (NN-010).",
      "type": "array",
      "items": {
        "type": "string",
        "minLength": 1
      }
    },
    "invariants": {
      "description": "Invariantes NN-XXX consideradas e evidência de respeito (MANIFEST §25).",
      "type": "array",
      "items": {
        "type": "object",
        "additionalProperties": false,
        "required": [
          "id",
          "evidence"
        ],
        "properties": {
          "id": {
            "type": "string",
            "pattern": "^NN-[0-9]{3}$"
          },
          "evidence": {
            "type": "string",
            "minLength": 1
          }
        }
      }
    },
    "cost": {
      "type": [
        "string",
        "null"
      ]
    },
    "reuse_assessment": {
      "description": "OPCIONAL (ADR-0011): potencial de reutilização de uma feature ou refatoração estrutural relevante, registrado onde o trabalho foi feito. Ausente em handoffs que não criam nem reestruturam funcionalidade. Quando presente, o check CHK-REUSE valida a semântica.",
      "type": "array",
      "items": {
        "type": "object",
        "additionalProperties": false,
        "required": [
          "subject",
          "status",
          "rationale"
        ],
        "properties": {
          "subject": {
            "description": "Slug estável da capacidade avaliada (por exemplo 'account-login'). O mesmo slug em handoffs de componentes diferentes significa a mesma necessidade.",
            "type": "string",
            "pattern": "^[a-z][a-z0-9]*(-[a-z0-9]+)*$"
          },
          "status": {
            "enum": [
              "product-specific",
              "possible-candidate",
              "external-consumer-exists"
            ]
          },
          "rationale": {
            "type": "string",
            "minLength": 1
          },
          "consumers": {
            "description": "Componentes (ids de ecosystem.json) que usam ou precisam concretamente da capacidade além do dono. Obrigatório (>= 1) em external-consumer-exists.",
            "type": "array",
            "items": {
              "type": "string",
              "pattern": "^[a-z][a-z0-9]*(-[a-z0-9]+)*$"
            }
          },
          "extraction_review": {
            "description": "Só em external-consumer-exists: 'pending' (a Extraction Review ainda não terminou), um ADR do Ecosystem (ADR-NNNN) que a concluiu, ou 'declined' (a review concluiu que continua local; a justificativa vai em rationale).",
            "type": "string",
            "pattern": "^(pending|declined|ADR-[0-9]{4})$"
          }
        }
      }
    },
    "criticality": {
      "description": "Escalada declarada pelo agente (ADD-0012): 'critical' torna a mudança crítica mesmo fora das zonas da política (ex.: muda formato de dados num arquivo comum); 'routine' não rebaixa nada. Julgada pela mudança do PR: handoff novo crítico escala; handoff já existente na main só escala se passar a crítico ou ganhar classe nova — fechar o registro de um trabalho crítico já integrado não herda a criticidade (o histórico fica). A classificação efetiva é derivada pelo integrador com a política da main e fica no PR (status ecosystem/integration) e no commit de integração (trailers Integration-*).",
      "type": "object",
      "additionalProperties": false,
      "required": [
        "declared"
      ],
      "properties": {
        "declared": {
          "enum": [
            "routine",
            "critical"
          ]
        },
        "classes": {
          "description": "IDs de classes de docs/governance/integration-policy.json.",
          "type": "array",
          "items": {
            "type": "string",
            "pattern": "^[a-z][a-z0-9]*(-[a-z0-9]+)*$"
          }
        },
        "reason": {
          "type": "string",
          "minLength": 1
        }
      }
    },
    "base_commit": {
      "description": "BASE (ADR-0014): SHA do commit de onde o agente partiu (normalmente a main lida no início). Obrigatório para handoffs a partir de 2026-10-01T19:00Z (CHK-HANDOFFS). Verificado contra o histórico quando há git completo.",
      "type": "string",
      "pattern": "^[0-9a-f]{7,40}$"
    },
    "change_scope": {
      "description": "Escopo declarado de MIGRATION ou REFACTOR (NN-013). O integrador da main compara com o diff real; exceções são caminhos exatos justificados, nunca outro Product. Testes antes/depois referenciam verification com tested_commit.",
      "type": "object",
      "additionalProperties": false,
      "required": [
        "kind",
        "product",
        "exceptions",
        "before_check",
        "after_check"
      ],
      "properties": {
        "kind": {
          "enum": [
            "migration",
            "refactor"
          ]
        },
        "product": {
          "type": "string",
          "pattern": "^[a-z][a-z0-9]*(-[a-z0-9]+)*$"
        },
        "exceptions": {
          "type": "array",
          "items": {
            "type": "object",
            "additionalProperties": false,
            "required": [
              "path",
              "reason"
            ],
            "properties": {
              "path": {
                "type": "string",
                "minLength": 1
              },
              "reason": {
                "type": "string",
                "minLength": 1
              }
            }
          }
        },
        "before_check": {
          "type": "string",
          "minLength": 1
        },
        "after_check": {
          "type": "string",
          "minLength": 1
        }
      }
    }
  }
}
